Question,Answer
When was the company founded?,"Immatics was founded in 2000 as a spin out from H.G. Rammensee’s laboratory at University Tübingen, Germany. In 2015, Immatics and MD Anderson Cancer Center launched Immatics US, Inc. in Houston Texas."
Where is the company incorporated?,We are incorporated under the laws of the Netherlands.
When did Immatics go public?,"Thursday, July 2, 2020."
When is Immatics’ fiscal year-end?,December 31st
How is Immatics’ stock traded?,Our common stock is listed on the Nasdaq Global Market under the ticker symbol IMTX.
Who are Immatics' independent auditors?,"PriceWaterhouseCoopers GmbH Wirtschaftsprüfungsgesellschaft (PwC)
Friedrich-Ebert-Anlage 35-37
60327 Frankfurt am Main"
Where can I get the latest corporate news releases and financial reports?,"Immatics’ press release archives can be viewed at: https://investors.immatics.com/press-releases
Our financial reports are available at: https://investors.immatics.com/financial-information/quarterly-reports/"
Who is Immatics’ transfer agent?,"Continental Stock Transfer & Trust Company
1 State Street
New York, New York 10004
Attention: Mark Zimkind
Email: mzimkind@continentalstock.com"
How can I view documents Immatics has filed with the Securities & Exchange Commission (SEC)?,Immatics’ SEC filings can be viewed at investors.immatics.com/financial-information/sec-filings or www.sec.gov.
